{
  "schema": "talos.update-manifest/1",
  "release_id": "019f5f1a-3000-7000-8000-000000000001",
  "channel": "beta",
  "version": "0.34.0",
  "minimum_current_version": "0.33.0",
  "published_at": "2026-07-19T11:00:00Z",
  "expires_at": "2026-07-20T11:00:00Z",
  "target": {
    "os": "windows",
    "architecture": "amd64"
  },
  "artifact": {
    "name": "talos-agent-0.34.0-windows-amd64.exe",
    "size_bytes": 1048576,
    "sha256": "aaaaaaaaaaaaaaaaaaaaaaaaaaaaaaaaaaaaaaaaaaaaaaaaaaaaaaaaaaaaaaaa"
  }
}
